{
  "$schema": "./deep-protocol-v1.registry.schema.json",
  "schemaVersion": "1.0.0",
  "registryGeneration": 1,
  "registryId": "deep-protocol-v1",
  "lifecycleDefinitions": [
    {
      "name": "FROZEN_TARGET_NOT_ACTIVE",
      "canReleaseEncode": false,
      "sourceId": "protocol-registry-v1"
    },
    {
      "name": "CURRENT_PRE_CUTOVER",
      "canReleaseEncode": false,
      "sourceId": "protocol-registry-v1"
    },
    {
      "name": "TARGET_UNFROZEN",
      "canReleaseEncode": false,
      "sourceId": "protocol-registry-v1"
    },
    {
      "name": "TARGET_RENAME_REQUIRED",
      "canReleaseEncode": false,
      "sourceId": "protocol-registry-v1"
    },
    {
      "name": "DECISION_REQUIRED",
      "canReleaseEncode": false,
      "sourceId": "protocol-registry-v1"
    },
    {
      "name": "RESERVED",
      "canReleaseEncode": false,
      "sourceId": "protocol-registry-v1"
    },
    {
      "name": "RETIRED_REJECT",
      "canReleaseEncode": false,
      "sourceId": "protocol-registry-v1"
    },
    {
      "name": "RELEASE_ACTIVE",
      "canReleaseEncode": true,
      "sourceId": "protocol-registry-v1"
    }
  ],
  "sources": [
    {
      "id": "publication-winner-read-decision",
      "kind": "normative-document",
      "path": "docs/survival-program/decisions/DR-0124-publication-winner-readback.md",
      "normalizedSha256": "3490adfca18e5c93c6b330923997f3782bdb567806e83641c3f824528f025cd6"
    },
    {
      "id": "publication-winner-read-v1",
      "kind": "normative-document",
      "path": "docs/survival-program/releases/v3.0.0/specs/contact-publication-winner-read-v1.registry.json",
      "normalizedSha256": "f148b0611279dd052a454303526a90daffdec684632b76337398439e1cd8b76b"
    },
    {
      "id": "publication-winner-read-v1-schema",
      "kind": "normative-document",
      "path": "docs/survival-program/releases/v3.0.0/specs/contact-publication-winner-read-v1.registry.schema.json",
      "normalizedSha256": "8ce7d568fe0c4f059f1ff151f8cd745f9576f5eff45b862199951517d650f50b"
    },
    {
      "id": "publication-winner-read-v1-vectors",
      "kind": "normative-document",
      "path": "docs/survival-program/releases/v3.0.0/specs/contact-publication-winner-read-v1.vectors.json",
      "normalizedSha256": "9a48be735269c951a8f4b4eacc22d2b4de99ad1cd481d6a541cdd96424e29ce8"
    },
    {
      "id": "publication-winner-read-v1-vectors-schema",
      "kind": "normative-document",
      "path": "docs/survival-program/releases/v3.0.0/specs/contact-publication-winner-read-v1.vectors.schema.json",
      "normalizedSha256": "145641235c3bc04690931ea97dce19055041c9d97a6956a5d6141f899970b9e9"
    },
    {
      "id": "contact-coordination-v2",
      "kind": "normative-document",
      "path": "docs/survival-program/releases/v3.0.0/specs/contact-coordination-v2.registry.json",
      "normalizedSha256": "7b4a409581fd1474f0d36472918d9d9c212bc2e1385bf495a99c8b18ee250864"
    },
    {
      "id": "protocol-registry-v1",
      "kind": "normative-document",
      "path": "docs/architecture/PROTOCOL-REGISTRY-V1.md",
      "normalizedSha256": "475c5e6329fa0fccd126ca94c8745bd0d7382e6eaa8e178ac6927684862e9d2c"
    },
    {
      "id": "dnp1-frozen",
      "kind": "approved-git-blob",
      "path": "docs/survival-program/releases/v3.0.0/specs/dnp1-classical-v1.registry.json",
      "normalizedSha256": "e036a0b6acb260e05e18ac536a723b0b8561d2ba1d813429304505b0e7a7da7b"
    },
    {
      "id": "deep-crypto-v1",
      "kind": "normative-document",
      "path": "docs/survival-program/releases/v3.0.0/specs/DEEP-CRYPTO-V1-DRAFT.md",
      "normalizedSha256": "c6d43940f309445525d62e494a086215b3327651476e6c9e2855b7ae3da0345c"
    },
    {
      "id": "braid-recovery-v2",
      "kind": "normative-document",
      "path": "docs/survival-program/releases/v3.0.0/specs/braid-recovery-v2.registry.json",
      "normalizedSha256": "1495dfa7a50cb07729afaf5c911bdb68a4d9a7154218f9330937968982f54f9b"
    },
    {
      "id": "privacy-routing-v1",
      "kind": "normative-document",
      "path": "deep-protocol/docs/deep-extension-privacy-routing-v1.md",
      "normalizedSha256": "0e2f3d1dd27723a1bcb89f38559eb78caf4cc9dba0c72b36a3980c489c22fa87"
    },
    {
      "id": "contact-group-v1",
      "kind": "normative-document",
      "path": "docs/architecture/CONTACT-AND-GROUP-PROTOCOL-V1.md",
      "normalizedSha256": "d4f68fa5e682197f754759f768910c922798766becf96bb052d4a064afd911c5"
    },
    {
      "id": "account-directory-v1",
      "kind": "normative-document",
      "path": "docs/architecture/ACCOUNT-DIRECTORY-TRANSPARENCY-V1.md",
      "normalizedSha256": "4e6aed0395983cab474ea4d3b9c99ebabd25e5259faa1f76c4faa7a94bca9c50"
    },
    {
      "id": "xpoint-network-v1",
      "kind": "normative-document",
      "path": "docs/architecture/XPOINT-NETWORK-V1.md",
      "normalizedSha256": "10f7b1fda0bb7c39955dc8f0cac3e0765893ba4f4b64e667bf9747b413a788b5"
    },
    {
      "id": "contact-resolver-v1",
      "kind": "normative-document",
      "path": "docs/architecture/CONTACT-RESOLVER-V1.md",
      "normalizedSha256": "245f54592ac36fae85b7c1e8b80f1cc20c1da4d5ddc283bfa1b80c6a9390dbbc"
    },
    {
      "id": "mailbox-grant-revocation-v1",
      "kind": "normative-document",
      "path": "docs/survival-program/releases/v3.0.0/specs/mailbox-grant-revocation-v1.registry.json",
      "normalizedSha256": "d095cf341893acf8750a3ec7b216c37986e269c8e7a88ca8df3ca40dc999f463"
    },
    {
      "id": "mailbox-retained-read-v2",
      "kind": "normative-document",
      "path": "docs/survival-program/releases/v3.0.0/specs/mailbox-retained-read-v2.registry.json",
      "normalizedSha256": "57dbbcc243a6bef5cf113bccdb28addf9f1b0c0c2a6037ebd8e37e333713644f"
    },
    {
      "id": "mailbox-retained-read-v2-schema",
      "kind": "normative-document",
      "path": "docs/survival-program/releases/v3.0.0/specs/mailbox-retained-read-v2.registry.schema.json",
      "normalizedSha256": "f6b9ece1820270c86bf1730f3f9468373d7baf47c336957d6f58a6e74c077df5"
    },
    {
      "id": "mailbox-retained-read-v2-vectors",
      "kind": "normative-document",
      "path": "docs/survival-program/releases/v3.0.0/specs/mailbox-retained-read-v2.vectors.json",
      "normalizedSha256": "e28132f992eff8080cc812dc1efac4346149422bfc58587bf782d0e0233367c5"
    },
    {
      "id": "mailbox-retained-read-v2-vectors-schema",
      "kind": "normative-document",
      "path": "docs/survival-program/releases/v3.0.0/specs/mailbox-retained-read-v2.vectors.schema.json",
      "normalizedSha256": "4c17612ac5bd0a9dab0d2305a916cf936daf386be7094caf0e7b77456224c6e9"
    },
    {
      "id": "mailbox-grant-revocation-v1-schema",
      "kind": "normative-document",
      "path": "docs/survival-program/releases/v3.0.0/specs/mailbox-grant-revocation-v1.registry.schema.json",
      "normalizedSha256": "c3ffec5ab9f84cf812640cb8dcc5b6e0876d29ca974158149f93ac632864a6a9"
    },
    {
      "id": "mailbox-grant-revocation-v1-vectors",
      "kind": "normative-document",
      "path": "docs/survival-program/releases/v3.0.0/specs/mailbox-grant-revocation-v1.vectors.json",
      "normalizedSha256": "b49b4778f01c55870487ba82ba98c33349bc23cefd9608627436f7e940d10314"
    },
    {
      "id": "mailbox-grant-revocation-v1-vectors-schema",
      "kind": "normative-document",
      "path": "docs/survival-program/releases/v3.0.0/specs/mailbox-grant-revocation-v1.vectors.schema.json",
      "normalizedSha256": "e0e8a29d0453cb8d21f7c00969cedca1ef6732d40dd82a77bbc61ad845d40979"
    },
    {
      "id": "carriers-v1",
      "kind": "normative-document",
      "path": "docs/architecture/CIRCUMVENTION-CARRIERS-V1.md",
      "normalizedSha256": "b6bdbd880400719a7b81511c71fb044628ce1ab80b92f683cecfc14a0266adfe"
    },
    {
      "id": "deployment-profiles-v1",
      "kind": "normative-document",
      "path": "docs/architecture/DEPLOYMENT-PROFILES.md",
      "normalizedSha256": "8fd1821eb22195006cb45a545592bab6abdc8a31bb1e3bdde410f0a43eae2254"
    },
    {
      "id": "call-session-v1",
      "kind": "normative-document",
      "path": "docs/architecture/CALL-SESSION-V1.md",
      "normalizedSha256": "15594ea80f29e60ce83f7207309ccfdb6dbf2161326efb9fe0f7631a3f4029b8"
    },
    {
      "id": "transport-neutral-v1",
      "kind": "normative-document",
      "path": "docs/architecture/TRANSPORT-NEUTRAL-MESSAGING.md",
      "normalizedSha256": "95201b096c9570493a06437fcf6127237840e5f43fc855a44a2f65143b18671b"
    },
    {
      "id": "production-wire-source",
      "kind": "production-source-scan",
      "path": "deep-protocol/src",
      "normalizedSha256": "1d5844f809185b22f54238371e1007f25019fb32fc889fb6ddfa678ca4b94b33"
    }
  ],
  "productionInventory": {
    "assemblies": [
      "Deep.Protocol",
      "Deep.Protocol.MembershipRoutes",
      "Deep.Protocol.ProfileCarrier"
    ],
    "excludedLiterals": [
      {
        "value": "POST",
        "reason": "HTTP method token, not a wire record magic"
      },
      {
        "value": "DNH2",
        "reason": "Host-protected local custody capsule allocated in protocol registry section 6.6, not a network wire record"
      }
    ],
    "knownCrossNamespaceCollisions": []
  },
  "imports": [
    {
      "id": "dnp1-classical-v1",
      "sourceId": "dnp1-frozen",
      "mode": "exact-approved-git-blob",
    "approvedCommit": "a8456987efe031388ca2eb9006886fb78f31e06c",
      "registry": {
        "path": "dnp1-classical-v1.registry.json",
      "gitBlob": "23f7bb55deb13a95babca07797c23b3b0b3fc593",
      "sha256": "e036a0b6acb260e05e18ac536a723b0b8561d2ba1d813429304505b0e7a7da7b"
      },
      "schema": {
        "path": "dnp1-classical-v1.registry.schema.json",
        "gitBlob": "a803315e9347bec8c719a48e23bc43728fd15f74",
        "sha256": "c8c8ce1fe5f0011efc69e1169a1e9860806207ffe05c1b2f0aaa51d5bbeb7195"
      }
    }
  ],
  "suiteScopes": [
    {
      "name": "dnp1-header-u16",
      "widthBits": 16,
      "sourceId": "dnp1-frozen"
    },
    {